{
 "id": "data-project-minimal",
 "source": "fake-app",
 "fetched_at": "2026-10-30T06:01:00Z",
 "as_of": "2026-10-30T06:00:00Z",
 "replay": false,
 "payload": {
  "situation": "project_checkpoint",
  "run_ref": "run-20261030T0600Z",
  "project_ref": "unassigned",
  "subject_revision": 0,
  "seats": [
   {
    "seat": "fake-seat-a",
    "answer_state": "unknown"
   }
  ],
  "sources": [
   {
    "source": "org_chart",
    "state": "unavailable",
    "reason": "No project register"
   }
  ],
  "flags": {
   "stale": "unknown",
   "blocked": "unknown"
  }
 }
}