{
 "id": "data-checkpoint",
 "source": "fake-app",
 "fetched_at": "2026-10-30T09:56:30Z",
 "as_of": "2026-10-30T09:56:00Z",
 "replay": false,
 "payload": {
  "situation": "checkpoint",
  "subject_ref": {
   "project_id": "fake-project",
   "seat_id": "fake-seat",
   "assignment_id": "fake-asg-0142"
  },
  "subject_revision": 8,
  "intervention_ref": "wi_01J8Z3Q4R5S6T7V8W9X0Y1Z2A3",
  "evidence": [
   {
    "kind": "source",
    "ref": "git:fake-repo/pr/41"
   }
  ],
  "freshness": [
   {
    "source": "git",
    "observed_at": "2026-10-30T09:20:00Z",
    "collected_at": "2026-10-30T09:21:00Z",
    "state": "healthy"
   }
  ],
  "primary_action": {
   "route": "intervention",
   "action_id": "act-update",
   "type": "request_update",
   "label": "Ask for an update",
   "enabled": true
  },
  "secondary_actions": [],
  "requested_at": "2026-10-30T09:10:00Z",
  "due_at": "2026-10-30T09:40:00Z",
  "delivery": "delivered",
  "response": "acknowledged",
  "work_ref": {
   "work_id": "wi_01J8Z3Q4R5S6T7V8W9X0Y1Z2A3",
   "source_ref": "repo:fake-repo/pr/41",
   "revision": "sha256:ab12ab12ab12ab12ab12ab12ab12ab12ab12ab12ab12ab12ab12ab12ab12ab12"
  }
 }
}