{
 "id": "data-decision-review-pair",
 "source": "fake-app",
 "fetched_at": "2026-10-30T09:56:30Z",
 "as_of": "2026-10-30T09:56:00Z",
 "replay": false,
 "payload": {
  "situation": "decision",
  "subject_ref": {
   "project_id": "fake-project",
   "seat_id": "fake-seat",
   "assignment_id": "fake-asg-0142"
  },
  "subject_revision": 10,
  "evidence": [
   {
    "kind": "source",
    "ref": "git:fake-repo/issue/77"
   }
  ],
  "freshness": [
   {
    "source": "git",
    "observed_at": "2026-10-30T09:35:00Z",
    "collected_at": "2026-10-30T09:36:00Z",
    "state": "healthy"
   }
  ],
  "primary_action": {
   "route": "intervention",
   "action_id": "act-explain",
   "type": "explain_blocker",
   "label": "Ask what the choice blocks",
   "enabled": true
  },
  "secondary_actions": [],
  "question": "Ship the narrow invoice export now?",
  "ask_type": "review",
  "why_operator": "judgment",
  "work_ref": {
   "work_id": "wi_01J8Z3Q4R5S6T7V8W9X0Y1Z2A3",
   "source_ref": "repo:fake-repo/pr/41",
   "revision": "sha256:ab12ab12ab12ab12ab12ab12ab12ab12ab12ab12ab12ab12ab12ab12ab12ab12"
  },
  "intervention_ref": "wi_01J8Z3Q4R5S6T7V8W9X0Y1Z2A3",
  "artifact": {
   "ref": "doc:fake-figure-review",
   "revision": "sha256:ab12ab12ab12ab12ab12ab12ab12ab12ab12ab12ab12ab12ab12ab12ab12ab12"
  },
  "review_images": [
   {
    "media_ref": "img_fake_pair_a",
    "label": "Figure 1, left (fake sample)",
    "alt": "Rebuilt figure, left half of the pair (fake sample)",
    "sha256": "sha256:9f74e4efee8db5b6f712ce92b9d23d665400532944ca73333d6d5db561268006",
    "byte_length": 1048576,
    "content_type": "image/png",
    "width": 1600,
    "height": 900
   },
   {
    "media_ref": "img_fake_pair_b",
    "label": "Figure 1, right (fake sample)",
    "alt": "Rebuilt figure, right half of the pair (fake sample)",
    "sha256": "sha256:d33c1391a5a10e4e3ebc460d51d5ee50ab6959ef3084971715990c5ebd0e5e5f",
    "byte_length": 1048576,
    "content_type": "image/png",
    "width": 1600,
    "height": 900
   }
  ]
 }
}