{
 "id": "data-decision-session",
 "source": "fake-app",
 "fetched_at": "2026-10-30T09:56:30Z",
 "as_of": "2026-10-30T09:56:00Z",
 "replay": false,
 "payload": {
  "situation": "decision",
  "subject_ref": {
   "project_id": "fake-project",
   "seat_id": "fake-seat",
   "assignment_id": "fake-asg-0142"
  },
  "subject_revision": 10,
  "evidence": [
   {
    "kind": "source",
    "ref": "git:fake-repo/issue/77"
   }
  ],
  "freshness": [
   {
    "source": "git",
    "observed_at": "2026-10-30T09:35:00Z",
    "collected_at": "2026-10-30T09:36:00Z",
    "state": "healthy"
   }
  ],
  "primary_action": {
   "route": "intervention",
   "action_id": "act-explain",
   "type": "explain_blocker",
   "label": "Ask what the choice blocks",
   "enabled": true
  },
  "secondary_actions": [],
  "question": "Ship the narrow invoice export now?",
  "ask_type": "session",
  "why_operator": "reserved_authority",
  "work_ref": {
   "work_id": "wi_01J8Z3Q4R5S6T7V8W9X0Y1Z2A3",
   "source_ref": "repo:fake-repo/pr/41",
   "revision": "sha256:ab12ab12ab12ab12ab12ab12ab12ab12ab12ab12ab12ab12ab12ab12ab12ab12"
  },
  "intervention_ref": "wi_01J8Z3Q4R5S6T7V8W9X0Y1Z2A3",
  "session": {
   "start": "2026-10-31T09:00:00Z",
   "duration_minutes": 30
  }
 }
}